<?xml version="1.0" encoding="UTF-8"?>
<!ELEMENT documentos (documento+)>

<!ELEMENT documento (InfoGenerica,Texto,Referencias)>
<!ELEMENT InfoGenerica (autor+)>
<!ATTLIST InfoGenerica
	titulo CDATA #REQUIRED
	data_publicacao CDATA #REQUIRED
	local_publicacao CDATA #REQUIRED
	entidade_publica CDATA #REQUIRED
	id ID #REQUIRED>

<!ELEMENT Texto (#PCDATA |Capitulo|Seccao|Subseccao|p|Formatar)*>
<!ELEMENT Capitulo (#PCDATA |Seccao|Subseccao|p|Formatar)*>
<!ATTLIST Capitulo
	id ID #REQUIRED>
<!ELEMENT Seccao (#PCDATA |Subseccao|p|Formatar)*>
<!ATTLIST Seccao
	id ID #REQUIRED>
<!ELEMENT Subseccao (#PCDATA | p|Formatar)*>
<!ATTLIST Subseccao
	id ID #REQUIRED>
<!ELEMENT p (#PCDATA | Formatar)*>
<!ATTLIST p
	id ID #REQUIRED>

<!ELEMENT Formatar ( #PCDATA | b | strong | i | u | em | image | goto | reference)* >
<!ELEMENT b (#PCDATA | strong | i | u | em | image | goto | reference)*>
<!ELEMENT strong (#PCDATA | em | i | u | b | image | goto | reference)*>
<!ELEMENT i (#PCDATA | strong | em | u | b | image | goto | reference)*>
<!ELEMENT u (#PCDATA | strong | i | em | b | image | goto | reference)*>
<!ELEMENT em (#PCDATA | strong | i | u | b | image | goto | reference)*>
<!ELEMENT reference (#PCDATA | strong | i | u | b | image | goto | em)*>
<!ATTLIST reference
	id IDREF #REQUIRED>
<!ELEMENT goto (#PCDATA | strong | i | u | b | image | em | reference)*>
<!ATTLIST goto
	id IDREF #REQUIRED>
<!ELEMENT image (#PCDATA | strong | i | u | b | em | goto | reference)*>
<!ATTLIST image
	url CDATA #REQUIRED>

	

<!ELEMENT Referencias (Referencia+)>
<!ELEMENT Referencia (autor+)>
<!ATTLIST Referencia
	id ID #REQUIRED
	titulo CDATA #REQUIRED
	ano CDATA #REQUIRED
	url CDATA #IMPLIED>
<!ELEMENT autor EMPTY>
<!ATTLIST autor
	nome CDATA #IMPLIED>